{
  "version": 1,
  "scannerVersion": "1.1.0",
  "generatedAt": "2026-06-08T13:39:06.449Z",
  "root": "/Users/vcsm/Desktop/VCSM",
  "scanDurationMs": 6492,
  "confidence": "HIGH",
  "engineEntrypointCount": 9,
  "data": {
    "version": 1,
    "generatedAt": "2026-06-08T13:39:03.725Z",
    "engines": [
      {
        "engine": "booking",
        "path": "engines/booking",
        "entrypoints": [
          "BOOKING_EVENTS",
          "assertActorCanManageLocation",
          "assertActorCanManageOrganization",
          "assertActorCanManageResource",
          "assertActorOwnsVportActor",
          "buildQrDestinationPath",
          "cancelBooking",
          "completeBooking",
          "configureBookingEngine",
          "confirmBooking",
          "createBooking",
          "createLocationResource",
          "createOrganizationLocationWorkspace",
          "createQrLink",
          "dismissBooking",
          "ensureOwnerBookingResource",
          "getBookingServiceProfiles",
          "getLocationAvailability",
          "getResourceAvailability",
          "invalidateBookingAvailability",
          "listBookingHistory",
          "listBookingResourcesByLocation",
          "listLocationsByOrganization",
          "listOrganizationsByOwnerActor",
          "listOwnerBookingResources",
          "listQrLinksByLocation",
          "listQrLinksByOrganization",
          "listQrLinksByProfile",
          "listResourceServiceOverrides",
          "mapAvailabilityExceptionRow",
          "mapAvailabilityRuleRow",
          "mapBookingResourceRow",
          "mapBookingResourceRows",
          "mapBookingRow",
          "mapBookingRows",
          "mapBookingServiceProfileRow",
          "mapBookingServiceProfileRows",
          "mapLocationMemberRow",
          "mapLocationMemberRows",
          "mapLocationRow",
          "mapLocationRows",
          "mapOrganizationMemberRow",
          "mapOrganizationMemberRows",
          "mapOrganizationProfileRow",
          "mapOrganizationRow",
          "mapOrganizationRows",
          "mapQrLinkRow",
          "mapQrLinkRows",
          "mapResourceAvailabilityModel",
          "mapResourceServiceOverrideRow",
          "mapResourceServiceOverrideRows",
          "mapVportResourceRow",
          "mapVportResourceRows",
          "markNoShow",
          "resolveBookingContext",
          "resolveQrScan",
          "resolveServicePricing",
          "setAvailabilityException",
          "setAvailabilityRule",
          "setResourceSlotDuration",
          "upsertResourceServiceOverride"
        ],
        "symbolConsumers": {
          "BOOKING_EVENTS": {
            "consumerCount": 0,
            "consumers": [],
            "status": "UNUSED_EXPORT"
          },
          "assertActorCanManageLocation": {
            "consumerCount": 0,
            "consumers": [],
            "status": "UNUSED_EXPORT"
          },
          "assertActorCanManageOrganization": {
            "consumerCount": 0,
            "consumers": [],
            "status": "UNUSED_EXPORT"
          },
          "assertActorCanManageResource": {
            "consumerCount": 0,
            "consumers": [],
            "status": "UNUSED_EXPORT"
          },
          "assertActorOwnsVportActor": {
            "consumerCount": 0,
            "consumers": [],
            "status": "UNUSED_EXPORT"
          },
          "buildQrDestinationPath": {
            "consumerCount": 0,
            "consumers": [],
            "status": "UNUSED_EXPORT"
          },
          "cancelBooking": {
            "consumerCount": 0,
            "consumers": [],
            "status": "UNUSED_EXPORT"
          },
          "completeBooking": {
            "consumerCount": 0,
            "consumers": [],
            "status": "UNUSED_EXPORT"
          },
          "configureBookingEngine": {
            "consumerCount": 1,
            "consumers": [
              "apps/VCSM/src/features/booking/setup.js"
            ],
            "status": "ACTIVE"
          },
          "confirmBooking": {
            "consumerCount": 0,
            "consumers": [],
            "status": "UNUSED_EXPORT"
          },
          "createBooking": {
            "consumerCount": 1,
            "consumers": [
              "apps/VCSM/src/features/booking/hooks/useCreateBooking.js"
            ],
            "status": "ACTIVE"
          },
          "createLocationResource": {
            "consumerCount": 1,
            "consumers": [
              "apps/VCSM/src/features/booking/hooks/useAddStaffResource.js"
            ],
            "status": "ACTIVE"
          },
          "createOrganizationLocationWorkspace": {
            "consumerCount": 2,
            "consumers": [
              "apps/VCSM/src/features/booking/hooks/useOrganizationWorkspace.js",
              "apps/VCSM/src/features/vport/controllers/submitCreateVport.controller.js"
            ],
            "status": "ACTIVE"
          },
          "createQrLink": {
            "consumerCount": 1,
            "consumers": [
              "apps/VCSM/src/features/booking/hooks/useQrLinks.js"
            ],
            "status": "ACTIVE"
          },
          "dismissBooking": {
            "consumerCount": 1,
            "consumers": [
              "apps/VCSM/src/features/notifications/screen/hooks/useMyAppointments.js"
            ],
            "status": "ACTIVE"
          },
          "ensureOwnerBookingResource": {
            "consumerCount": 1,
            "consumers": [
              "apps/VCSM/src/features/booking/hooks/useEnsureOwnerBookingResource.js"
            ],
            "status": "ACTIVE"
          },
          "getBookingServiceProfiles": {
            "consumerCount": 1,
            "consumers": [
              "apps/VCSM/src/features/booking/hooks/useBookingServiceProfiles.js"
            ],
            "status": "ACTIVE"
          },
          "getLocationAvailability": {
            "consumerCount": 0,
            "consumers": [],
            "status": "UNUSED_EXPORT"
          },
          "getResourceAvailability": {
            "consumerCount": 1,
            "consumers": [
              "apps/VCSM/src/features/booking/hooks/useBookingAvailability.js"
            ],
            "status": "ACTIVE"
          },
          "invalidateBookingAvailability": {
            "consumerCount": 0,
            "consumers": [],
            "status": "UNUSED_EXPORT"
          },
          "listBookingHistory": {
            "consumerCount": 1,
            "consumers": [
              "apps/VCSM/src/features/booking/hooks/useBookingHistory.js"
            ],
            "status": "ACTIVE"
          },
          "listBookingResourcesByLocation": {
            "consumerCount": 1,
            "consumers": [
              "apps/VCSM/src/features/booking/hooks/useLocationResources.js"
            ],
            "status": "ACTIVE"
          },
          "listLocationsByOrganization": {
            "consumerCount": 1,
            "consumers": [
              "apps/VCSM/src/features/booking/hooks/useOrganizationLocations.js"
            ],
            "status": "ACTIVE"
          },
          "listOrganizationsByOwnerActor": {
            "consumerCount": 1,
            "consumers": [
              "apps/VCSM/src/features/booking/hooks/useOrganizationWorkspace.js"
            ],
            "status": "ACTIVE"
          },
          "listOwnerBookingResources": {
            "consumerCount": 1,
            "consumers": [
              "apps/VCSM/src/features/booking/hooks/useOwnerBookingResources.js"
            ],
            "status": "ACTIVE"
          },
          "listQrLinksByLocation": {
            "consumerCount": 0,
            "consumers": [],
            "status": "UNUSED_EXPORT"
          },
          "listQrLinksByOrganization": {
            "consumerCount": 0,
            "consumers": [],
            "status": "UNUSED_EXPORT"
          },
          "listQrLinksByProfile": {
            "consumerCount": 1,
            "consumers": [
              "apps/VCSM/src/features/booking/hooks/useQrLinks.js"
            ],
            "status": "ACTIVE"
          },
          "listResourceServiceOverrides": {
            "consumerCount": 1,
            "consumers": [
              "apps/VCSM/src/features/booking/hooks/useResourceServiceOverrides.js"
            ],
            "status": "ACTIVE"
          },
          "mapAvailabilityExceptionRow": {
            "consumerCount": 0,
            "consumers": [],
            "status": "UNUSED_EXPORT"
          },
          "mapAvailabilityRuleRow": {
            "consumerCount": 0,
            "consumers": [],
            "status": "UNUSED_EXPORT"
          },
          "mapBookingResourceRow": {
            "consumerCount": 0,
            "consumers": [],
            "status": "UNUSED_EXPORT"
          },
          "mapBookingResourceRows": {
            "consumerCount": 0,
            "consumers": [],
            "status": "UNUSED_EXPORT"
          },
          "mapBookingRow": {
            "consumerCount": 0,
            "consumers": [],
            "status": "UNUSED_EXPORT"
          },
          "mapBookingRows": {
            "consumerCount": 0,
            "consumers": [],
            "status": "UNUSED_EXPORT"
          },
          "mapBookingServiceProfileRow": {
            "consumerCount": 0,
            "consumers": [],
            "status": "UNUSED_EXPORT"
          },
          "mapBookingServiceProfileRows": {
            "consumerCount": 0,
            "consumers": [],
            "status": "UNUSED_EXPORT"
          },
          "mapLocationMemberRow": {
            "consumerCount": 0,
            "consumers": [],
            "status": "UNUSED_EXPORT"
          },
          "mapLocationMemberRows": {
            "consumerCount": 0,
            "consumers": [],
            "status": "UNUSED_EXPORT"
          },
          "mapLocationRow": {
            "consumerCount": 0,
            "consumers": [],